,adult,belongs_to_collection,budget,genres,homepage,id,imdb_id,original_language,original_title,overview,popularity,poster_path,production_companies,production_countries,release_date,revenue,runtime,spoken_languages,status,tagline,title,video,vote_average,vote_count,Date,Month,Year,imdb_metascore
26560,False,"{'id': 295, 'name': 'Pirates of the Caribbean Collection', 'poster_path': '/zT5UKFhq9nk97VGlBbAxlAK8UFN.jpg', 'backdrop_path': '/cnKAGbX1rDkAquF2V1wVkptHDJO.jpg'}",230000000,"[{'id': 12, 'name': 'Adventure'}, {'id': 28, 'name': 'Action'}, {'id': 14, 'name': 'Fantasy'}, {'id': 35, 'name': 'Comedy'}]",http://pirates.disney.com/pirates-of-the-caribbean-dead-men-tell-no-tales,166426,tt1790809,en,Pirates of the Caribbean: Dead Men Tell No Tales,"Thrust into an all-new paycheck, a down-on-his-luck Capt. Jack Sparrow feels the winds of ill-fortune blowing even more strongly when deadly ghost sailors led by his old nemesis, the evil Capt. Salazar, escape from the Devil's Triangle. Jack's only hope of a payout lies in seeking out the legendary Trident of Numbers, but to find it, he must forge an uneasy alliance with a reasonably intelligent and pretty astronomer and a irritating young man in the British navy.",133.82782,/xbpSDU3p7YUGlu9Mr6Egg2Vweto.jpg,"[{'name': 'Walt Disney Pictures', 'id': 2}, {'name': 'Jerry Bruckheimer Films', 'id': 130}, {'name': 'Infinitum Nihil', 'id': 2691}, {'name': 'Moving Picture Company (MPC)', 'id': 20478}]","[{'iso_3166_1': 'US', 'name': 'United States of America'}]",2017-05-23,794191988.0,129.0,"[{'iso_639_1': 'en', 'name': 'English'}]",Released,,Pirates of the Caribbean: Dead Men Tell No Tales,False,6.6,2814.0,2017-05-23,5.0,2017.0,39.0
26561,False,"{'id': 468551, 'name': 'Justice League Collection', 'poster_path': None, 'backdrop_path': '/vyxOJuk6cxrRcGzuMRbDTpwji1w.jpg'}",0,"[{'id': 28, 'name': 'Action'}, {'id': 12, 'name': 'Adventure'}, {'id': 14, 'name': 'Fantasy'}, {'id': 878, 'name': 'Science Fiction'}]",http://www.justiceleaguethemovie.com,141052,tt0974015,en,Justice League,"Fueled by his restored faith in humanity and inspired by Superman's selfless act, Bruce Wayne and Diana Prince assemble a team of metahumans consisting of Barry Allen, Arthur Curry, and Victor Stone to face the catastrophic threat of Steppenwolf and the Parademons who are on the hunt for three Mother Boxes on Earth.",25.944629,/9rtrRGeRnL0JKtu9IMBWsmlmmZz.jpg,"[{'name': 'DC Comics', 'id': 429}, {'name': 'Kennedy Miller Productions', 'id': 2537}, {'name': 'Lin Pictures', 'id': 2723}, {'name': 'Warner Bros.', 'id': 6194}, {'name': 'DC Entertainment', 'id': 9993}, {'name': 'RatPac-Dune Entertainment', 'id': 41624}, {'name': 'Cruel and Unusual Films', 'id': 78685}]","[{'iso_3166_1': 'US', 'name': 'United States of America'}]",2017-11-15,0.0,0.0,"[{'iso_639_1': 'en', 'name': 'English'}]",Post Production,,Justice League,False,0.0,0.0,2017-11-15,11.0,2017.0,45.0
26565,False,"{'id': 131296, 'name': 'Thor Collection', 'poster_path': '/yw7gr7DhHHVTLlO8Se8uH17TDMA.jpg', 'backdrop_path': '/3KL8UNKFWgIKXzLHjwY0uwgjzYl.jpg'}",0,"[{'id': 28, 'name': 'Action'}, {'id': 12, 'name': 'Adventure'}, {'id': 14, 'name': 'Fantasy'}, {'id': 878, 'name': 'Science Fiction'}]",https://marvel.com/movies/movie/222/thor_ragnarok,284053,tt3501632,en,Thor: Ragnarok,"Thor is imprisoned on the other side of the universe and finds himself in a race against time to get back to Asgard to stop Ragnarok, the destruction of his homeworld and the end of Asgardian civilization, at the hands of an all-powerful new threat, the ruthless Hela.",57.283628,/avy7IR8UMlIIyE2BPCI4plW4Csc.jpg,"[{'name': 'Walt Disney Pictures', 'id': 2}, {'name': 'Marvel Studios', 'id': 420}]","[{'iso_3166_1': 'AU', 'name': 'Australia'}]",2017-10-25,0.0,0.0,"[{'iso_639_1': 'en', 'name': 'English'}]",Post Production,,Thor: Ragnarok,False,0.0,0.0,2017-10-25,10.0,2017.0,74.0
26566,False,"{'id': 284433, 'name': 'Guardians of the Galaxy Collection', 'poster_path': '/iL8mukexAqEg0xK783rG561tdd8.jpg', 'backdrop_path': '/jdyyjulTBU8YUYAUvQFj6U1g2Pj.jpg'}",200000000,"[{'id': 28, 'name': 'Action'}, {'id': 12, 'name': 'Adventure'}, {'id': 35, 'name': 'Comedy'}, {'id': 878, 'name': 'Science Fiction'}]",http://marvel.com/movies/movie/221/guardians_of_the_galaxy_vol_2,283995,tt3896198,en,Guardians of the Galaxy Vol. 2,The Guardians must fight to keep their newfound family together as they unravel the mysteries of Peter Quill's true parentage.,185.33099199999998,/y4MBh0EjBlMuOzv9axM4qJlmhzz.jpg,"[{'name': 'Walt Disney Pictures', 'id': 2}, {'name': 'Marvel Studios', 'id': 420}]","[{'iso_3166_1': 'US', 'name': 'United States of America'}]",2017-04-19,863416141.0,137.0,"[{'iso_639_1': 'en', 'name': 'English'}]",Released,Obviously.,Guardians of the Galaxy Vol. 2,False,7.6,4858.0,2017-04-19,4.0,2017.0,67.0
30536,False,,0,"[{'id': 14, 'name': 'Fantasy'}, {'id': 28, 'name': 'Action'}, {'id': 12, 'name': 'Adventure'}]",,245842,tt2328678,en,The King's Daughter,"King Louis XIV's quest for immortality leads him to capture and steal a mermaid's life force, a move that is further complicated by his illegitimate daughter's discovery of the creature.",1.138419,/xBLskcmADJYJrDw3O04XdMvrE2m.jpg,"[{'name': 'Paramount Pictures', 'id': 4}, {'name': 'Good Universe', 'id': 17393}]","[{'iso_3166_1': 'FR', 'name': 'France'}, {'iso_3166_1': 'AU', 'name': 'Australia'}]",2017-12-30,0.0,0.0,"[{'iso_639_1': 'en', 'name': 'English'}]",Post Production,What on Earth Can Hold More Power Than a King?,The King's Daughter,False,0.0,4.0,2017-12-30,12.0,2017.0,n/a
30994,False,,3400000,"[{'id': 53, 'name': 'Thriller'}, {'id': 12, 'name': 'Adventure'}]",http://expeditionfootage.com/,279988,tt3033080,en,Extinction Jurassic Predators 2017,"The amazing footage you will see in this documentary was recorded during an expedition to the Amazon in South America. It has been assembled as per the camera time codes. It has not been altered or tampered with in any way and after extensive testing has been considered absolutely genuine. What you will see will change the way you view the natural world. Are you ready for that? For in the heart of the rainforest, a team of researchers led by the respected Professor John Howson strived to protect endangered and vulnerable species from extinction. But their guides abandoned them after a series of strange and unexplainable events and the team soon got hopelessly lost in the jungle. When events took a horrifying turn, the team realized that they were in the hunting grounds of an apex predator. And now they were the ones on the endangered species list.",1.862426,/53pVxhzJjTlFqxXEyf39Cf2g7qq.jpg,"[{'name': 'Pinnacle Media', 'id': 27848}, {'name': 'Hollywood Vision', 'id': 27849}, {'name': 'Dark Art Films', 'id': 53599}]","[{'iso_3166_1': 'GB', 'name': 'United Kingdom'}]",2017-03-10,0.0,100.0,"[{'iso_639_1': 'en', 'name': 'English'}, {'iso_639_1': 'fr', 'name': 'Français'}]",Released,Extinction: Nature Has Evolved,Extinction: Nature Has Evolved,False,0.0,10.0,2017-03-10,3.0,2017.0,n/a
31994,False,,0,"[{'id': 18, 'name': 'Drama'}, {'id': 35, 'name': 'Comedy'}]",http://forhereortogomovie.com/,326241,tt4157510,en,For Here or to Go?,An aspiring Indian tech entrepreneur in the Silicon Valley finds himself unexpectedly battling the bizarre American immigration system to keep his dream alive or prepare to return home forever.,0.5795640000000001,/bQzbh4ULjGlsUjTdkWWQG58L4a6.jpg,"[{'name': 'Many Cups of Chai Films', 'id': 87116}]","[{'iso_3166_1': 'US', 'name': 'United States of America'}]",2017-03-31,0.0,105.0,"[{'iso_639_1': 'en', 'name': 'English'}, {'iso_639_1': 'hi', 'name': 'हिन्दी'}]",Released,,For Here or to Go?,False,0.0,1.0,2017-03-31,3.0,2017.0,56.0
32531,False,,7000000,"[{'id': 28, 'name': 'Action'}, {'id': 14, 'name': 'Fantasy'}, {'id': 878, 'name': 'Science Fiction'}]",,354556,tt4600952,ru,Защитники,"During the Cold War, an organization called ""Patriot"" created a super-hero squad, which includes members of multiple soviet republics. For years, the heroes had to hide their identities, but in hard times they must show themselves again.",10.830129,/r1cJPzC85XsVOzai8MMG9Qe4AH6.jpg,"[{'name': 'Enjoy Movies', 'id': 9340}, {'name': 'Big Cinema House', 'id': 87064}, {'name': 'Renovatio Entertainment', 'id': 94075}]","[{'iso_3166_1': 'RU', 'name': 'Russia'}]",2017-02-14,0.0,100.0,"[{'iso_639_1': 'ru', 'name': 'Pусский'}]",Released,Squad of Soviet Superheroes,Guardians,False,4.4,128.0,2017-02-14,2.0,2017.0,n/a
32732,False,,0,"[{'id': 35, 'name': 'Comedy'}]",,306943,tt2597760,en,The Outcasts,"After falling victim to a humiliating prank by the high school Queen Bee, best friends and world-class geeks, Mindy and Jodi, decide to get their revenge by uniting the outcasts of the school against her and her circle of friends.",10.591249000000001,/44jotbmLRwHSIcd4wVAYCVmli8D.jpg,"[{'name': 'BCDF Pictures', 'id': 10290}]","[{'iso_3166_1': 'US', 'name': 'United States of America'}]",2017-04-14,0.0,95.0,"[{'iso_639_1': 'en', 'name': 'English'}]",Released,Let the battle for high school begin.,The Outcasts,False,7.1,141.0,2017-04-14,4.0,2017.0,47.0
33356,False,"{'id': 468552, 'name': 'Wonder Woman Collection', 'poster_path': '/yEczguvMSFJRuUiOFgWXsZG3CsG.jpg', 'backdrop_path': '/n9KlvCOBFDmSyw3BgNrkUkxMFva.jpg'}",149000000,"[{'id': 28, 'name': 'Action'}, {'id': 12, 'name': 'Adventure'}, {'id': 14, 'name': 'Fantasy'}]",http://www.warnerbros.com/wonder-woman,297762,tt0451279,en,Wonder Woman,An Amazon princess comes to the world of Man to become the greatest of the female superheroes.,294.337037,/imekS7f1OuHyUP2LAiTEM0zBzUz.jpg,"[{'name': 'Dune Entertainment', 'id': 444}, {'name': 'Atlas Entertainment', 'id': 507}, {'name': 'Warner Bros.', 'id': 6194}, {'name': 'DC Entertainment', 'id': 9993}, {'name': 'Cruel & Unusual Films', 'id': 9995}, {'name': 'TENCENT PICTURES', 'id': 81620}, {'name': 'Wanda Pictures', 'id': 83838}]","[{'iso_3166_1': 'US', 'name': 'United States of America'}]",2017-05-30,820580447.0,141.0,"[{'iso_639_1': 'de', 'name': 'Deutsch'}, {'iso_639_1': 'en', 'name': 'English'}]",Released,Power. Grace. Wisdom. Wonder.,Wonder Woman,False,7.2,5025.0,2017-05-30,5.0,2017.0,76.0
33358,False,,0,"[{'id': 16, 'name': 'Animation'}, {'id': 12, 'name': 'Adventure'}, {'id': 35, 'name': 'Comedy'}, {'id': 28, 'name': 'Action'}, {'id': 10751, 'name': 'Family'}]",http://www.slycoopermovie.com,252983,tt3498786,en,Sly Cooper,"Sly Cooper is a kinetic and comedic heist film that tells the story of Sly Cooper, an orphaned raccoon thief, along with his childhood friends and partners in crime, Bentley Turtle and Murray Hippo. In the film, Sly learns of his birth family's secret legacy; that he comes from a long line of talented and international thieves. Endowed with this knowledge, Sly and his friends are catapulted into a global adventure as they race to reassemble pieces of an ancient book holding The Cooper Clan's family secrets before it can fall into the hands of Clockwerk -- an evil Russian metallic owl bent on ending the Cooper family line. From romantic Parisian backdrops to the lush mountains of China, gritty film noir meets bright, colorful graphic novels in this origin story of the world's greatest thief-turned-hero.",1.531827,/rw36cctUD5kPCNCxFYsQ7F205B8.jpg,"[{'name': 'Rainmaker Entertainment', 'id': 2213}, {'name': 'Cinema Management Group', 'id': 25032}, {'name': 'Blockade Entertainment', 'id': 30786}, {'name': 'Sony Computer Entertainment', 'id': 30794}]","[{'iso_3166_1': 'CA', 'name': 'Canada'}, {'iso_3166_1': 'US', 'name': 'United States of America'}]",2017-12-31,0.0,0.0,"[{'iso_639_1': 'en', 'name': 'English'}]",In Production,,Sly Cooper,False,0.0,0.0,2017-12-31,12.0,2017.0,n/a
33361,False,,18000000,"[{'id': 18, 'name': 'Drama'}, {'id': 53, 'name': 'Thriller'}, {'id': 878, 'name': 'Science Fiction'}]",http://wearethecircle.com/,339988,tt4287320,en,The Circle,"A young tech worker takes a job at a greedy Internet corporation, quickly rises up the company's ranks, and soon finds herself in a perilous situation concerning privacy, surveillance and freedom. She comes to learn that her decisions and actions will have no effect whatsoever.",88.439243,/bQVqd5rWrx5GbXhJNuvKy4Viz6j.jpg,"[{'name': 'Likely Story', 'id': 1785}, {'name': 'Playtone', 'id': 4171}, {'name': 'Image Nation', 'id': 53299}]","[{'iso_3166_1': 'US', 'name': 'United States of America'}]",2017-04-27,20497844.0,110.0,"[{'iso_639_1': 'en', 'name': 'English'}]",Released,Knowing is good. Knowing everything is better.,The Circle,False,5.4,1015.0,2017-04-27,4.0,2017.0,43.0
33370,False,"{'id': 306031, 'name': 'Pitch Perfect Collection', 'poster_path': '/n1bCFVJeVxX1yCTnXy4OCRwynF1.jpg', 'backdrop_path': '/jolu4gMP6g2VmUZt099U6X6jNNJ.jpg'}",0,"[{'id': 35, 'name': 'Comedy'}]",,353616,tt4765284,en,Pitch Perfect 3,Sequel to Pitch Perfect 2,3.782498,/A4bAz2rvc0vjitQ7sm0gyqgaehp.jpg,[],[],2017-12-21,0.0,0.0,"[{'iso_639_1': 'en', 'name': 'English'}]",In Production,,Pitch Perfect 3,False,0.0,3.0,2017-12-21,12.0,2017.0,40.0
33753,False,,0,[],,324017,,en,The Master,"In 19th-century China, during the infamous Qing Dynasty, the population is suffering at the hands of greedy landlords, corrupt officials, and unwelcome invaders. Hoping to unite his people, martial arts master Chen Xiang opens a school integrating techniques from both the North and South. But after Chen refuses to join the armies of the Qing Prince, his mother and his students are seized. To save them, Chen has only one path: all-out war.",0.414474,,[],[],2017-01-01,0.0,109.0,[],Released,,The Master,False,0.0,0.0,2017-01-01,1.0,2017.0,n/a
35694,False,,0,"[{'id': 27, 'name': 'Horror'}]",,354216,tt4935372,en,The Devil's Candy,"A struggling painter is possessed by satanic forces after he and his young family move into their dream home in rural Texas, in this creepy haunted-house tale.",9.968649,/xLw8nDNLuffMdvjYXQLwL6UCXcs.jpg,"[{'name': 'Snoot Entertainment', 'id': 15159}]","[{'iso_3166_1': 'US', 'name': 'United States of America'}]",2017-03-17,0.0,90.0,"[{'iso_639_1': 'en', 'name': 'English'}]",Released,,The Devil's Candy,False,6.4,114.0,2017-03-17,3.0,2017.0,72.0
36990,False,,0,"[{'id': 18, 'name': 'Drama'}]",http://www.ninaninofilms.com/las-plantas-the-plants-2015/,379388,tt5305262,es,Las Plantas,"For a whole  summer, 17-year-old Florencia has to look after her brother, who is  trapped in a persistent vegetative state. She washes him, changes his  nappies, and cuddles up to him in bed. From time to time she reads  to him from a comic called LAS  PLANTAS,  which is about plant souls  that take control of human bodies at full moon. At night, Florencia  makes contact with men on the internet. Images of her monotonous  daily routine and a vibrant fantasy world merge to create a fascina-  ting tale of a young woman as she self-determines her own sexual  awakening. Dreamlike sequences and atmospheric, metallic music  create the mood of a thriller.",0.218588,/eQPV77QNMBYo0uAVcQemoVkUBSU.jpg,"[{'name': 'La Ventura', 'id': 12380}]","[{'iso_3166_1': 'CL', 'name': 'Chile'}]",2017-01-27,0.0,93.0,"[{'iso_639_1': 'es', 'name': 'Español'}]",Released,Do you think plants could have souls?  That we might even be able to talk to  them?,Las Plantas,False,0.0,1.0,2017-01-27,1.0,2017.0,n/a
37619,False,"{'id': 263866, 'name': ""Nuke 'Em High Collection"", 'poster_path': '/eI4x4Sv2C4Et7Be2RCZY7EpNk0H.jpg', 'backdrop_path': None}",0,"[{'id': 35, 'name': 'Comedy'}, {'id': 27, 'name': 'Horror'}]",http://return2nukeemhigh.com/,207680,tt3039472,en,"Return to Return to Nuke 'Em High, aka Volume 2","Following the events of Volume 1,  the mutated glee club continue their violent rampage in Tromaville. Chrissy and Lauren, two innocent lesbian lovers, must fight not only the Cretins, mutants, and monsters but also the evil Tromorganic Foodstuffs Conglomerate. Can they, and Kevin the Wonder Duck, save Tromaville High School and the world?",0.906976,/knZGNrKSeuE59VciiMBrGOJ9fZU.jpg,"[{'name': 'Troma Entertainment', 'id': 3052}, {'name': 'Troma', 'id': 6423}]","[{'iso_3166_1': 'US', 'name': 'United States of America'}]",2017-01-15,0.0,72.0,"[{'iso_639_1': 'en', 'name': 'English'}]",Released,,"Return to Return to Nuke 'Em High, aka Volume 2",False,0.0,0.0,2017-01-15,1.0,2017.0,n/a
38043,False,,0,"[{'id': 10770, 'name': 'TV Movie'}, {'id': 53, 'name': 'Thriller'}]",http://www.mylifetime.com/movies/the-cheerleader-murders,392418,tt4896904,en,The Cheerleader Murders,"A high school student whose father and sister were recently murdered begins her own investigation after two of her fellow cheerleaders are kidnapped. She sets out on a rescue mission, but the killer may already be hot on her trail.",0.877195,/pT0IDVth10tL620r46XVYybEXWU.jpg,"[{'name': 'Marvista Entertainment', 'id': 6679}]","[{'iso_3166_1': 'US', 'name': 'United States of America'}]",2017-03-17,0.0,84.0,"[{'iso_639_1': 'en', 'name': 'English'}]",Released,,The Cheerleader Murders,False,4.0,2.0,2017-03-17,3.0,2017.0,n/a
38113,False,,0,"[{'id': 35, 'name': 'Comedy'}]",,305342,tt3914332,en,Dean,A freelance illustrator in New York suffers a quarter-life crisis and leaves his home for the west coast.,1.807007,/qO5DIwznN6p3ms87ZrStB0pz9EW.jpg,"[{'name': 'Honora Productions', 'id': 39077}, {'name': 'Spring Pictures', 'id': 54602}]","[{'iso_3166_1': 'US', 'name': 'United States of America'}]",2017-06-02,0.0,87.0,"[{'iso_639_1': 'en', 'name': 'English'}]",Released,,Dean,False,7.7,6.0,2017-06-02,6.0,2017.0,58.0
38608,False,"{'id': 111751, 'name': 'Texas Chainsaw Massacre Collection', 'poster_path': '/lxYgt4gS4CEvfC2ZCa83IiOsOiu.jpg', 'backdrop_path': '/1zIwt7gUyxKhOKYXN5XNGdGxwHg.jpg'}",0,"[{'id': 27, 'name': 'Horror'}]",,300665,tt2620590,en,Leatherface,"A young nurse is kidnapped by a group of violent teens who escape from a mental hospital and take her on the road trip from hell. Pursued by an equally deranged lawman out for revenge, one of these teens is destined for tragedy and horrors that will destroy his mind, molding him into the monster we now call Leatherface.",9.742082,/qdRq1EygZK2LIYM6v29ai9uBOhE.jpg,"[{'name': 'Campbell Grobman Films', 'id': 48738}, {'name': 'LF2 Productions', 'id': 65518}]","[{'iso_3166_1': 'US', 'name': 'United States of America'}]",2017-09-14,0.0,90.0,"[{'iso_639_1': 'en', 'name': 'English'}]",Released,The Origin Story of The Texas Chain Saw Massacre,Leatherface,False,5.7,62.0,2017-09-14,9.0,2017.0,40.0
39694,False,,5500000,"[{'id': 18, 'name': 'Drama'}, {'id': 53, 'name': 'Thriller'}, {'id': 27, 'name': 'Horror'}, {'id': 12, 'name': 'Adventure'}]",https://47metersdownmovie.com/,403119,tt2932536,en,47 Meters Down,"Two sisters on Mexican vacation are trapped in a shark observation cage at the bottom of the ocean, with oxygen running low and great whites circling nearby, they have less than an hour of air left to figure out how to get to the surface.",52.854103,/2IgdRUTdHyoI3nFORcnnYEKOGIH.jpg,"[{'name': 'Dimension Films', 'id': 7405}, {'name': 'Tea Shop & Film Company', 'id': 13161}, {'name': 'The Fyzz Facility', 'id': 63443}, {'name': 'Flexibon Films', 'id': 79822}]","[{'iso_3166_1': 'GB', 'name': 'United Kingdom'}]",2017-06-15,44235023.0,89.0,"[{'iso_639_1': 'en', 'name': 'English'}]",Released,No way out. No way up. No chance in hell.,47 Meters Down,False,5.1,548.0,2017-06-15,6.0,2017.0,52.0
39922,False,,0,"[{'id': 10749, 'name': 'Romance'}, {'id': 18, 'name': 'Drama'}]",,374471,tt4446472,en,Porto,"Jake and Mati are two outsiders in the northerly Portuguese city of Porto who once experienced a brief connection. A mystery remains about the moments they shared, and in searching through memories, they relive the depths of a night uninhibited by the consequences of time.",2.152189,/2jsNrAJx3z1uzrw4Jg1XIvOl7Cv.jpg,[],"[{'iso_3166_1': 'PL', 'name': 'Poland'}, {'iso_3166_1': 'PT', 'name': 'Portugal'}, {'iso_3166_1': 'FR', 'name': 'France'}, {'iso_3166_1': 'US', 'name': 'United States of America'}]",2017-09-14,0.0,75.0,"[{'iso_639_1': 'en', 'name': 'English'}, {'iso_639_1': 'fr', 'name': 'Français'}, {'iso_639_1': 'pt', 'name': 'Português'}]",Released,,Porto,False,7.8,5.0,2017-09-14,9.0,2017.0,48.0
40390,False,,700000,"[{'id': 35, 'name': 'Comedy'}, {'id': 18, 'name': 'Drama'}, {'id': 10751, 'name': 'Family'}, {'id': 14, 'name': 'Fantasy'}, {'id': 10749, 'name': 'Romance'}, {'id': 878, 'name': 'Science Fiction'}]",http://www.mamaboythemovie.com/,388256,tt4818168,en,Mamaboy,"A high school student must hide the fact that he has become pregnant from his family, friends and the school faculty!",1.061991,/ocsSTZEAbNuz68yqsfbOFlas9N4.jpg,"[{'name': 'My Hero Productions', 'id': 90139}]","[{'iso_3166_1': 'US', 'name': 'United States of America'}]",2017-05-23,0.0,124.0,"[{'iso_639_1': 'en', 'name': 'English'}]",Released,High school just got weirder.,Mamaboy,False,1.0,1.0,2017-05-23,5.0,2017.0,n/a
40396,False,,0,"[{'id': 99, 'name': 'Documentary'}]",,413765,tt1691152,en,David Lynch: The Art Life,"An intimate journey through the formative years of [Lynch’s] life. From his idyllic upbringing in small town America to the dark streets of Philadelphia, we follow Lynch as he traces the events that have helped to shape one of cinema’s most enigmatic directors. David Lynch: The Art Life infuses Lynch’s own art, music and early films, shining a light into the dark corners of his unique world, giving audiences a better understanding of the man and the artist.",2.901372,/pgtQceTZKylB2B237t18h2pOXpE.jpg,[],[],2017-02-15,0.0,90.0,"[{'iso_639_1': 'en', 'name': 'English'}]",Released,,David Lynch: The Art Life,False,7.2,32.0,2017-02-15,2.0,2017.0,75.0
40506,False,,0,"[{'id': 36, 'name': 'History'}, {'id': 10749, 'name': 'Romance'}, {'id': 18, 'name': 'Drama'}]",http://www.survivalpictures.org/the-promise/,354859,tt4776998,en,The Promise,"Set during the last days of the Ottoman Empire, a love triangle develops between Mikael, a brilliant medical student, the beautiful and sophisticated artist Ana, and Chris, a renowned American journalist based in Paris.",9.555114,/iDWer2VFikupdqDc7d5sxCWZ3gW.jpg,"[{'name': 'Babieka', 'id': 20656}, {'name': 'Wonderful Films', 'id': 61018}, {'name': 'Survivor Pictures', 'id': 61019}]","[{'iso_3166_1': 'ES', 'name': 'Spain'}, {'iso_3166_1': 'US', 'name': 'United States of America'}]",2017-04-21,0.0,130.0,"[{'iso_639_1': 'hy', 'name': ''}, {'iso_639_1': 'de', 'name': 'Deutsch'}, {'iso_639_1': 'en', 'name': 'English'}, {'iso_639_1': 'fr', 'name': 'Français'}]",Released,Empires fall. Love survives.,The Promise,False,7.3,69.0,2017-04-21,4.0,2017.0,49.0
40721,False,,45000000,"[{'id': 18, 'name': 'Drama'}, {'id': 10402, 'name': 'Music'}]",http://www.alleyez.movie/,402529,tt1666185,en,All Eyez on Me,"All Eyez on Me chronicles the life and legacy of Tupac Shakur, including his rise to superstardom as a hip-hop artist, actor, poet and activist, as well as his imprisonment and prolific, controversial time at Death Row Records. Against insurmountable odds, Tupac rose to become a cultural icon whose career and persona both continue to grow long after his passing.",9.809168,/zmgsaKFWbmZ1Grz4SO0PLNxilv3.jpg,"[{'name': 'Morgan Creek Productions', 'id': 10210}]","[{'iso_3166_1': 'US', 'name': 'United States of America'}]",2017-06-12,0.0,139.0,"[{'iso_639_1': 'en', 'name': 'English'}]",Released,Legends never die,All Eyez on Me,False,6.3,436.0,2017-06-12,6.0,2017.0,38.0
40843,False,,0,"[{'id': 28, 'name': 'Action'}, {'id': 35, 'name': 'Comedy'}, {'id': 18, 'name': 'Drama'}, {'id': 14, 'name': 'Fantasy'}, {'id': 878, 'name': 'Science Fiction'}]",http://sheiscolossal.com,339967,tt4680182,en,Colossal,A woman discovers that severe catastrophic events are somehow connected to the mental breakdown from which she's suffering.,25.373662,/4VOyofBd1pexblxtDZYtYIk7NI4.jpg,"[{'name': 'Brightlight Pictures', 'id': 1063}, {'name': 'Sayaka Producciones Audiovisuales', 'id': 7344}, {'name': 'Route One Entertainment', 'id': 80835}, {'name': 'Toy Fight Productions', 'id': 90622}, {'name': 'Neon', 'id': 90733}]","[{'iso_3166_1': 'CA', 'name': 'Canada'}, {'iso_3166_1': 'ES', 'name': 'Spain'}]",2017-04-06,3021345.0,110.0,"[{'iso_639_1': 'en', 'name': 'English'}]",Released,There's a monster in all of us,Colossal,False,6.2,394.0,2017-04-06,4.0,2017.0,70.0
40880,False,,0,"[{'id': 99, 'name': 'Documentary'}, {'id': 18, 'name': 'Drama'}]",,86822,tt1945228,en,Voyage of Time: Life's Journey,"A celebration of the universe, displaying the whole of time, from its start to its final collapse. This film examines all that occurred to prepare the world that stands before us now: science and spirit, birth and death, the grand cosmos and the minute life systems of our planet. (Wide release version with narration by Cate Blanchett.)",6.913581,/lfdinlGEkAwZGa4FOxKN6kMAt61.jpg,"[{'name': 'Plan B Entertainment', 'id': 81}, {'name': 'Wild Bunch', 'id': 856}, {'name': 'River Road Entertainment', 'id': 1246}, {'name': 'Sycamore Pictures', 'id': 14319}, {'name': 'Sophisticated Films', 'id': 81837}]","[{'iso_3166_1': 'DE', 'name': 'Germany'}, {'iso_3166_1': 'US', 'name': 'United States of America'}, {'iso_3166_1': 'FR', 'name': 'France'}]",2017-04-13,0.0,90.0,"[{'iso_639_1': 'en', 'name': 'English'}]",Released,From So Simple a Beginning.,Voyage of Time: Life's Journey,False,6.2,32.0,2017-04-13,4.0,2017.0,68.0
