,adult,belongs_to_collection,budget,genres,homepage,id,imdb_id,original_language,original_title,overview,popularity,poster_path,production_companies,production_countries,release_date,revenue,runtime,spoken_languages,status,tagline,title,video,vote_average,vote_count,Date,Month,Year,imdb_metascore
44337,False,,197471676,"[{'id': 12, 'name': 'Adventure'}, {'id': 878, 'name': 'Science Fiction'}, {'id': 28, 'name': 'Action'}]",,339964,tt2239822,en,Valerian and the City of a Thousand Planets,"In the 28th century, Valerian and Laureline are special operatives charged with keeping order throughout the human territories. On assignment from the Minister of Defense, the two undertake a mission to Alpha, an ever-expanding metropolis where species from across the universe have converged over centuries to share knowledge, intelligence, and cultures. At the center of Alpha is a mysterious dark force which threatens the peaceful existence of the City of a Thousand Planets, and Valerian and Laureline must race to identify the menace and safeguard not just Alpha, but the future of the universe.",15.262706,/8L7FE3bXjN98BcmKANzrL9WwKsK.jpg,"[{'name': 'EuropaCorp', 'id': 6896}]","[{'iso_3166_1': 'FR', 'name': 'France'}]",2017-07-20,90024292.0,137.0,"[{'iso_639_1': 'fr', 'name': 'Français'}, {'iso_639_1': 'en', 'name': 'English'}]",Released,,Valerian and the City of a Thousand Planets,False,6.7,905.0,2017-07-20,7.0,2017.0,51.0
44344,False,,0,"[{'id': 27, 'name': 'Horror'}, {'id': 878, 'name': 'Science Fiction'}, {'id': 28, 'name': 'Action'}]",https://www.ismovies.net/movie/the-gracefield-incident,327253,tt4464394,en,The Gracefield Incident,"On August 16, 2013, the Supreme Court mandated the CIA to declassify files that had been kept secret for the past 75 years. Visual records of documented paranormal events were released to the public. The following incident took place in Gracefield, Quebec.",4.184306,/lWZsV3dJfpWlEQG1Yn7GUSmrxdh.jpg,[],[],2017-07-21,0.0,95.0,"[{'iso_639_1': 'en', 'name': 'English'}]",Post Production,,The Gracefield Incident,False,4.7,26.0,2017-07-21,7.0,2017.0,21.0
44348,False,,0,"[{'id': 10402, 'name': 'Music'}, {'id': 99, 'name': 'Documentary'}]",,431714,tt4143508,en,Long Strange Trip,"The tale of the Grateful Dead is inspiring, complicated, and downright messy. A tribe of contrarians, they made art out of open-ended chaos and inadvertently achieved success on their own terms. Never-before-seen footage and interviews offer this unprecedented and unvarnished look at the life of the Dead.",0.617655,/oSEVqbrqUj8w8UaK8pLNqrANmYT.jpg,"[{'name': 'Amazon Studios', 'id': 20580}]",[],2017-01-23,0.0,235.0,"[{'iso_639_1': 'en', 'name': 'English'}]",Released,,Long Strange Trip,False,10.0,1.0,2017-01-23,1.0,2017.0,78.0
44350,False,,0,"[{'id': 10770, 'name': 'TV Movie'}, {'id': 99, 'name': 'Documentary'}]",http://www.hbo.com/documentaries/warning-this-drug-may-kill-you,452372,tt6710212,en,Warning: This Drug May Kill You,"A harrowing, unflinching look at the devastating effects of opioid addiction in the U.S. told from the perspectives of four families devastated by the deadly epidemic.",0.526562,/nYpGQB1np06do1L689JTkpzIZJz.jpg,[],"[{'iso_3166_1': 'US', 'name': 'United States of America'}]",2017-05-01,0.0,60.0,"[{'iso_639_1': 'en', 'name': 'English'}]",Released,America's prescription opiods kill more than pain.,Warning: This Drug May Kill You,False,7.0,3.0,2017-05-01,5.0,2017.0,n/a
44352,False,,0,"[{'id': 99, 'name': 'Documentary'}]",,433878,tt6333096,en,The Mars Generation,Aspiring teenage astronauts reveal that a journey to Mars is closer than you think.,0.774638,/czL0pSnPEEJJsjrJzg8q86ALvnE.jpg,"[{'name': 'Time', 'id': 2402}, {'name': 'Netflix', 'id': 59811}, {'name': 'SuperFilms!', 'id': 89960}]","[{'iso_3166_1': 'US', 'name': 'United States of America'}]",2017-01-20,0.0,97.0,"[{'iso_639_1': 'en', 'name': 'English'}]",Released,"Some dream of space, others dare to conquer it.",The Mars Generation,False,7.5,10.0,2017-01-20,1.0,2017.0,n/a
44356,False,,0,"[{'id': 10749, 'name': 'Romance'}, {'id': 12, 'name': 'Adventure'}, {'id': 18, 'name': 'Drama'}, {'id': 36, 'name': 'History'}]",,447236,tt4964310,hu,Kincsem,The new owner of a brilliant race horse finds love while carrying out his revenge on the man who murdered his father.,0.544214,/adLu7x7iLcwx52zb8t9imvKQuAA.jpg,[],"[{'iso_3166_1': 'HU', 'name': 'Hungary'}]",2017-03-16,0.0,121.0,"[{'iso_639_1': 'hu', 'name': 'Magyar'}]",Released,,Kincsem,False,5.3,3.0,2017-03-16,3.0,2017.0,n/a
44390,False,,0,"[{'id': 35, 'name': 'Comedy'}]",,458310,tt6900644,en,Hasan Minhaj: Homecoming King,"Comic Hasan Minhaj of ""The Daily Show"" shares personal stories about racism, immigrant parents, prom night horrors and more in this stand-up special.",1.531309,/qnd3bxP6k1Wbk6Gl76avB9GaO0U.jpg,"[{'name': 'Netflix', 'id': 59811}]","[{'iso_3166_1': 'US', 'name': 'United States of America'}]",2017-05-23,0.0,72.0,"[{'iso_639_1': 'en', 'name': 'English'}, {'iso_639_1': 'hi', 'name': 'हिन्दी'}, {'iso_639_1': 'ur', 'name': 'اردو'}]",Released,,Hasan Minhaj: Homecoming King,False,8.1,22.0,2017-05-23,5.0,2017.0,n/a
44394,False,,0,"[{'id': 35, 'name': 'Comedy'}]",,400552,tt5584176,de,Happy Burnout,,1.340083,/vj6rC4aVgnEe1ZV8NOmWeJVEcgI.jpg,[],"[{'iso_3166_1': 'DE', 'name': 'Germany'}]",2017-04-11,0.0,,[],Released,,Happy Burnout,False,5.3,3.0,2017-04-11,4.0,2017.0,n/a
44407,False,,0,"[{'id': 35, 'name': 'Comedy'}]",,459295,tt6948354,en,Sarah Silverman: A Speck of Dust,"In her first comedy special post-health scare, Sarah Silverman shares a mix of fun facts, sad truths and yeah-she-just-went-there moments.",0.828399,/z5BooW5DZhplz18yjahUf4KuliL.jpg,"[{'name': 'NetFlix', 'id': 8858}, {'name': 'Netflix', 'id': 59811}, {'name': 'Netflix Studios', 'id': 92957}]","[{'iso_3166_1': 'US', 'name': 'United States of America'}]",2017-05-30,0.0,71.0,"[{'iso_639_1': 'en', 'name': 'English'}]",Released,,Sarah Silverman: A Speck of Dust,False,7.7,11.0,2017-05-30,5.0,2017.0,n/a
44413,False,,0,[],,446850,tt6389344,ru,Tri bogatyrya i Morskoy tsar,No plot overview available,0.468664,/kuKCxn2onz7OfsWrKbwG0udg31O.jpg,[],[],2017-01-01,0.0,75.0,"[{'iso_639_1': 'ru', 'name': 'Pусский'}]",Released,,Three heroes and the King of the Sea,False,5.5,2.0,2017-01-01,1.0,2017.0,n/a
44414,False,,0,"[{'id': 27, 'name': 'Horror'}, {'id': 28, 'name': 'Action'}, {'id': 14, 'name': 'Fantasy'}, {'id': 53, 'name': 'Thriller'}]",,430988,tt6569546,ru,Вурдалаки,"The story takes place in 18th century russia. empress elizabeth’s confessor, monk named Lavr, is exiled to a monastery in a haunted mountainous region, taking his secret ancient knowledge with him. Years later, the empress sends her godson Andrey to bring the monk back. Andrey travels to the ill-famed place and meets with Lavr, but before they can return to St. Petersburg they must face evil forces and creatures of the dark side.",9.334447,/tA7revVjwKOd7JnNyi2P4gK4mVM.jpg,"[{'name': 'VVP-Alyans', 'id': 22090}, {'name': 'Gorad', 'id': 81886}]","[{'iso_3166_1': 'RU', 'name': 'Russia'}]",2017-02-22,0.0,90.0,"[{'iso_639_1': 'ru', 'name': 'Pусский'}]",Released,,Vamps,False,5.0,6.0,2017-02-22,2.0,2017.0,n/a
44419,False,,0,"[{'id': 18, 'name': 'Drama'}, {'id': 27, 'name': 'Horror'}, {'id': 53, 'name': 'Thriller'}]",http://breakdownlanemovie.com/,401359,tt3121200,en,Breakdown Lane,"When Kirby Lane's SUV breaks down in the middle of the desert, she must overcome the dehydration, coyotes, and lurking undead to find her way home.",0.957068,/nevwDR8ODeY7nqdZlEo0gqGH6ZA.jpg,"[{'name': 'Twilight Pictures', 'id': 86936}]","[{'iso_3166_1': 'CA', 'name': 'Canada'}]",2017-01-05,0.0,76.0,"[{'iso_639_1': 'en', 'name': 'English'}]",Released,It's time to kick some zombie ass!,Breakdown Lane,False,4.0,8.0,2017-01-05,1.0,2017.0,n/a
44420,False,,0,"[{'id': 35, 'name': 'Comedy'}, {'id': 10402, 'name': 'Music'}]",,382589,tt5351818,fr,Rock'n Roll,"Guillaume Canet is told by a young co-star that he's no longer Rock'n' Roll and can't sell films anymore. He then tries to prove her wrong and gets help from his girlfriend, Marion Cotillard.",6.677459,/xwMcbjyvekxn6hFgxuwgyByKX81.jpg,"[{'name': 'M6 Films', 'id': 1115}, {'name': 'Les Productions du Trésor', 'id': 2612}, {'name': 'Pathé', 'id': 7981}]","[{'iso_3166_1': 'FR', 'name': 'France'}]",2017-02-15,0.0,123.0,"[{'iso_639_1': 'fr', 'name': 'Français'}]",Released,,Rock'n Roll,False,5.4,194.0,2017-02-15,2.0,2017.0,n/a
44421,False,,0,"[{'id': 53, 'name': 'Thriller'}]",,76812,tt2090465,en,Black Butterfly,"Paul is a down-on-his-luck screenwriter who picks up a drifter and offers him a place to stay. However, when the deranged stranger takes Paul hostage and forces him to write, their unhinged relationship brings buried secrets to light.",20.058633,/cbFMuxF8p6C7Sbutbxsc4M57jrH.jpg,"[{'name': 'Battleplan Productions', 'id': 2108}, {'name': 'Ambi Pictures', 'id': 27753}, {'name': 'Compadre Entertainment', 'id': 59663}, {'name': 'Paradox Studios', 'id': 72810}]","[{'iso_3166_1': 'US', 'name': 'United States of America'}]",2017-05-26,0.0,93.0,"[{'iso_639_1': 'en', 'name': 'English'}]",Released,,Black Butterfly,False,6.5,93.0,2017-05-26,5.0,2017.0,43.0
44422,False,,0,"[{'id': 80, 'name': 'Crime'}, {'id': 99, 'name': 'Documentary'}]",http://www.IamJaneDoeFilm.com,430448,tt6398054,en,I Am Jane Doe,"Chronicles the epic battle that several American mothers are waging on behalf of their middle-school daughters, victims of sex-trafficking on Backpage.com, the adult classifieds section that for years was part of the Village Voice.",1.833216,/cQw2jh60Ey3zY90B8965JRclKQ2.jpg,"[{'name': '50 Eggs', 'id': 84494}]","[{'iso_3166_1': 'US', 'name': 'United States of America'}]",2017-02-10,0.0,91.0,"[{'iso_639_1': 'en', 'name': 'English'}]",Planned,Speak Out. Fight Back.,I Am Jane Doe,False,6.7,10.0,2017-02-10,2.0,2017.0,69.0
44524,False,,0,"[{'id': 99, 'name': 'Documentary'}]",,453053,tt6794450,en,Dumb: The Story of Big Brother Magazine,"The story of the rise and fall of the 1990s skate boarding magazine, ""Big Brother.""",0.444744,/xwNBsH7AqC1dldUW4IXNZd1Q23i.jpg,"[{'name': 'Hulu', 'id': 58423}]","[{'iso_3166_1': 'US', 'name': 'United States of America'}]",2017-06-03,0.0,79.0,"[{'iso_639_1': 'en', 'name': 'English'}]",Post Production,,Dumb: The Story of Big Brother Magazine,False,6.0,1.0,2017-06-03,6.0,2017.0,n/a
44534,False,,0,[],,413992,tt2582498,en,Sweet Virginia,A former rodeo champ befriends a young man with a propensity for violence.,1.718775,/lwc4wabnPW9wEe9IoTG5w2Q4oBN.jpg,[],[],2017-11-17,0.0,95.0,"[{'iso_639_1': 'en', 'name': 'English'}]",Released,,Sweet Virginia,False,0.0,1.0,2017-11-17,11.0,2017.0,72.0
44536,False,,0,"[{'id': 99, 'name': 'Documentary'}]",,436305,tt6223974,en,The Farthest,Documentary about NASA's Voyager space programme,1.196529,/8juskIY6aErYUnKukqnDnTGyqXF.jpg,"[{'name': 'Crossing the Line Productions', 'id': 90490}]","[{'iso_3166_1': 'IE', 'name': 'Ireland'}]",2017-02-26,0.0,120.0,"[{'iso_639_1': 'en', 'name': 'English'}]",Released,12 billion miles and counting...,The Farthest,False,8.3,6.0,2017-02-26,2.0,2017.0,87.0
44540,False,,0,"[{'id': 12, 'name': 'Adventure'}, {'id': 16, 'name': 'Animation'}]",,378111,tt3823116,de,A Stork's Journey,"Orphaned at birth and raised by storks, the teenage sparrow Richard believes he is one of them. But when the time comes to migrate to Africa, his stork family is forced to reveal his true identity and leave him behind in the forest, since he is not a migratory bird and would not survive the journey. Determined to prove he is a stork after all, Richard ventures south on his own. But only with the help of Olga, an eccentric owl with an imaginary friend and Kiki, a narcissistic, disco-singing parakeet, does he stand a chance to reach his goal and learn to accept who he really is.",9.459123,/yd4ZGlZ2gL6V0tCFwfYggEOZiRf.jpg,"[{'name': 'Mélusine Productions', 'id': 69192}]","[{'iso_3166_1': 'BE', 'name': 'Belgium'}, {'iso_3166_1': 'LU', 'name': 'Luxembourg'}, {'iso_3166_1': 'DE', 'name': 'Germany'}, {'iso_3166_1': 'NO', 'name': 'Norway'}]",2017-05-11,0.0,85.0,"[{'iso_639_1': 'sv', 'name': 'svenska'}]",Released,Their adventure is the destination.,A Stork's Journey,False,5.1,11.0,2017-05-11,5.0,2017.0,n/a
44551,False,,0,"[{'id': 18, 'name': 'Drama'}]",,408616,tt4826674,en,The Journey,"Firebrand Democratic Unionist Party leader Ian Paisley and Sinn Fein politician Martin McGuinness, two implacable enemies in Northern Ireland, are forced to take a short journey together in which they will take the biggest leap of faith and change the course of history.",0.859277,/avmWN1YGYbzW4n1cbffw4uLCZSr.jpg,"[{'name': 'Tempo Productions Limited', 'id': 60622}, {'name': 'Greenroom Entertainment', 'id': 70773}]","[{'iso_3166_1': 'GB', 'name': 'United Kingdom'}]",2017-03-30,0.0,94.0,"[{'iso_639_1': 'en', 'name': 'English'}]",Released,,The Journey,False,7.4,5.0,2017-03-30,3.0,2017.0,53.0
44552,False,,0,"[{'id': 99, 'name': 'Documentary'}]",,419192,tt5031332,en,McLaren,"The story of New Zealander, Bruce McLaren, who founded the McLaren Motor Racing team, showing the world that a man of humble beginnings could take on the elite of motor racing and win.",1.487037,/yRWIvyWNgsuPSHEVIMbS9aDY280.jpg,"[{'name': 'General Film Corporation', 'id': 13742}]","[{'iso_3166_1': 'NZ', 'name': 'New Zealand'}]",2017-05-25,0.0,94.0,"[{'iso_639_1': 'en', 'name': 'English'}]",Released,Pioneer. Leader. Father. Champion.,McLaren,False,8.0,13.0,2017-05-25,5.0,2017.0,n/a
44558,False,,0,"[{'id': 35, 'name': 'Comedy'}, {'id': 28, 'name': 'Action'}, {'id': 12, 'name': 'Adventure'}]",,456098,tt2312184,en,All About the Money,"Two ""down on their luck"" buddies are convinced by a third to take a vacation. Only after landing in the third world country do they realize that they are there to attempt to capture the United States' most wanted criminal - with no military training.",0.918121,/AoR9XuGB0NROiv7YgtJoBAfm40C.jpg,[],[],2017-06-02,0.0,0.0,[],Released,,All About the Money,False,6.7,6.0,2017-06-02,6.0,2017.0,n/a
44575,False,,7200,"[{'id': 9648, 'name': 'Mystery'}, {'id': 99, 'name': 'Documentary'}]",,457307,tt6679360,ru,Он вам не Димон,,0.351969,/kI9NRfC9CdPmL7YzE3czdClKRmA.jpg,[],"[{'iso_3166_1': 'RU', 'name': 'Russia'}]",2017-03-02,0.0,0.0,"[{'iso_639_1': 'ru', 'name': 'Pусский'}]",Released,,"Don't call him ""Dimon""",False,7.5,6.0,2017-03-02,3.0,2017.0,n/a
44578,False,,0,"[{'id': 18, 'name': 'Drama'}]",,340027,tt3704700,en,Brain on Fire,A look at a young woman's rapid descent into insanity.,4.341687,/3PGkcyCDtjEHvyhi5eAkKdWkA6w.jpg,"[{'name': 'Denver and Delilah Productions', 'id': 3574}, {'name': 'Foundation Features', 'id': 12217}, {'name': 'Blank Pages Productions', 'id': 42101}, {'name': 'Broad Green Pictures', 'id': 49389}]","[{'iso_3166_1': 'IE', 'name': 'Ireland'}, {'iso_3166_1': 'CA', 'name': 'Canada'}]",2017-02-22,0.0,95.0,"[{'iso_639_1': 'en', 'name': 'English'}]",Released,,Brain on Fire,False,8.0,41.0,2017-02-22,2.0,2017.0,34.0
44582,False,,5000000,"[{'id': 878, 'name': 'Science Fiction'}, {'id': 53, 'name': 'Thriller'}]",,436994,tt6830780,ko,루시드 드림,"Dae-ho, an investigative journalist, seeks to track down the whereabouts of his son who was abducted three years ago. With the help of a detective and a psychiatrist friend, he will retrace his memory of the incident through the use of lucid dreaming techniques.",1.748838,/kFNCZo3ME1q83x6AfkSdhGZZOUG.jpg,"[{'name': '(주)로드픽쳐스', 'id': 87426}]","[{'iso_3166_1': 'KR', 'name': 'South Korea'}]",2017-02-22,0.0,101.0,"[{'iso_639_1': 'ko', 'name': '한국어/조선말'}]",Released,,Lucid Dream,False,6.8,27.0,2017-02-22,2.0,2017.0,n/a
44584,False,,4000000,"[{'id': 53, 'name': 'Thriller'}]",,452068,tt5352846,en,Drone,Ideologies collide with fatal results when a military drone contractor meets an enigmatic Pakistani businessman.,8.413334,/o1Zp7DBOkxDhGCg6fXhuaFaFwsN.jpg,"[{'name': 'Pacific Northwest Pictures', 'id': 45909}, {'name': 'Gold Star Productions', 'id': 89121}, {'name': 'Look to the Sky Films', 'id': 89122}, {'name': 'Daylight Media', 'id': 92103}]","[{'iso_3166_1': 'CA', 'name': 'Canada'}]",2017-05-26,0.0,91.0,"[{'iso_639_1': 'en', 'name': 'English'}]",Released,Choose your target wisely.,Drone,False,5.7,55.0,2017-05-26,5.0,2017.0,49.0
44585,False,"{'id': 169452, 'name': 'DragonHeart Collection', 'poster_path': '/bZsqwJnO65wlZ3ez7dopUQMYALY.jpg', 'backdrop_path': '/hRucBWgzCc7iA9avUE2k5gc7dkj.jpg'}",0,"[{'id': 12, 'name': 'Adventure'}]",,451644,tt5610626,en,Dragonheart: Battle for the Heartfire,"When the King Gareth dies, his potential heirs, twin grandchildren who possess the dragon’s unique strengths, use their inherited powers against each other to vie for the throne. When Drago’s source of power – known as the Heartfire – is stolen, more than the throne is at stake; the siblings must end their rivalry with swords and sorcery or the kingdom may fall.",7.794894,/xMFfqIvSqDb5zBLelDHRbjec4Ua.jpg,[],"[{'iso_3166_1': 'US', 'name': 'United States of America'}]",2017-06-13,0.0,98.0,"[{'iso_639_1': 'en', 'name': 'English'}]",Released,,Dragonheart: Battle for the Heartfire,False,5.7,25.0,2017-06-13,6.0,2017.0,n/a
44590,False,,0,"[{'id': 12, 'name': 'Adventure'}, {'id': 878, 'name': 'Science Fiction'}]",,460024,tt5702566,en,Stasis,"After a night out of partying and left behind by her friends, Ava wakes up and sneaks back home only to find that she's already safe in bed. But that's not Ava - it's someone who looks just like her. A time-traveling fugitive has stolen Ava's body, her identity, and her life. What's more -- she's not alone. There are others, hiding in the past, secretly living among us, plotting to alter the future. Without her body, Ava is a virtual ghost, silent and invisible to the world. And, so far as she knows, she's the only one who can stop them and put the timeline back on course.",6.868237,/g0AgiPF1qBObVDLK7pwncujVpuo.jpg,"[{'name': 'Vangard Productions', 'id': 92086}, {'name': 'PraxiScope Productions', 'id': 92087}]","[{'iso_3166_1': 'US', 'name': 'United States of America'}]",2017-06-02,0.0,84.0,"[{'iso_639_1': 'en', 'name': 'English'}, {'iso_639_1': 'pt', 'name': 'Português'}]",Released,Their war. Our time.,Stasis,False,4.0,37.0,2017-06-02,6.0,2017.0,n/a
44591,False,,0,"[{'id': 10749, 'name': 'Romance'}]",,448763,tt5635808,pt,Amor.com,It's a love story between a fashion blogger and a video game blogger. The beauty and the nerd.,1.957136,/oMs1B6TaVBOw8DFjcOWKr9OqJBW.jpg,"[{'name': 'Total Entertainment', 'id': 6446}]","[{'iso_3166_1': 'BR', 'name': 'Brazil'}]",2017-06-01,0.0,92.0,"[{'iso_639_1': 'pt', 'name': 'Português'}]",Released,,Amor.com,False,6.8,17.0,2017-06-01,6.0,2017.0,n/a
44595,False,,0,"[{'id': 35, 'name': 'Comedy'}, {'id': 10751, 'name': 'Family'}, {'id': 18, 'name': 'Drama'}]",http://www.growingupsmithmovie.com,426469,tt1105355,en,Growing Up Smith,"In 1979, an Indian family moves to America with hopes of living the American Dream. While their 10-year-old boy Smith falls head-over-heels for the girl next door, his desire to become a ""good old boy"" propels him further away from his family's ideals than ever before.",1.435904,/ncALkAajnctju0CYKH4bFm40QJD.jpg,[],[],2017-02-03,0.0,102.0,"[{'iso_639_1': 'en', 'name': 'English'}]",Released,It’s better to stand out than to fit in.,Growing Up Smith,False,7.4,7.0,2017-02-03,2.0,2017.0,n/a
44602,False,,0,"[{'id': 18, 'name': 'Drama'}]",http://www.thefilmcollaborative.org/films/awol,356752,tt4462372,en,AWOL,A young woman in the Army must make tough decisions when her love for an older woman causes her to question just where she is going. Adapted from Deb Shoval's 2011 short film of the same name.,2.146718,/cK1DvOZWUVujRgRXPFYCP6XDUxS.jpg,"[{'name': 'Race Point Films', 'id': 88370}, {'name': 'Public Square Films', 'id': 91716}]","[{'iso_3166_1': 'US', 'name': 'United States of America'}]",2017-05-19,0.0,82.0,"[{'iso_639_1': 'en', 'name': 'English'}]",Released,,AWOL,False,5.3,3.0,2017-05-19,5.0,2017.0,n/a
44604,False,,0,"[{'id': 53, 'name': 'Thriller'}, {'id': 80, 'name': 'Crime'}, {'id': 18, 'name': 'Drama'}, {'id': 9648, 'name': 'Mystery'}]",,457962,tt1386691,en,Shimmer Lake,An inventive crime thriller told backwards -- reversing day by day through a week -- following a local sheriff's quest to unlock the mystery of three small town criminals and a bank heist gone wrong.,6.965189,/bQHhpTHiys0CZRrdDRKvXBmM5KL.jpg,"[{'name': 'Footprint Features', 'id': 35076}]","[{'iso_3166_1': 'CA', 'name': 'Canada'}, {'iso_3166_1': 'US', 'name': 'United States of America'}]",2017-06-09,0.0,83.0,"[{'iso_639_1': 'en', 'name': 'English'}]",Released,,Shimmer Lake,False,6.0,74.0,2017-06-09,6.0,2017.0,n/a
44612,False,,0,"[{'id': 28, 'name': 'Action'}, {'id': 80, 'name': 'Crime'}, {'id': 53, 'name': 'Thriller'}]",,445224,tt6690310,zh,非凡任务,"‘Extraordinary Mission’ is a new Chinese action thriller directed by Alan Mak (‘Infernal Affairs’) and Anthony Pun.  The film revolves an undercover police officer who attempts to take down a drug trafficking syndicate from the inside. The cast includes Huang Xuan, Duan Yihong, Lang Yueting, Zu Feng, Xing Jia-Dong, and David Wang.",2.552316,/yvNOI8x3K6ZTNJVjvTkPq4KyrW1.jpg,"[{'name': 'Pop Movies', 'id': 5690}, {'name': '北京完美影视传媒有限责任公司', 'id': 91007}, {'name': 'CMC Pictures', 'id': 92484}]","[{'iso_3166_1': 'CN', 'name': 'China'}]",2017-03-31,0.0,117.0,"[{'iso_639_1': 'cn', 'name': '广州话 / 廣州話'}, {'iso_639_1': 'zh', 'name': '普通话'}]",Released,,Extraordinary Mission,False,8.7,3.0,2017-03-31,3.0,2017.0,n/a
44624,False,,0,"[{'id': 878, 'name': 'Science Fiction'}, {'id': 53, 'name': 'Thriller'}]",,406990,tt1536537,en,What Happened to Monday,"In a world where families are limited to one child due to overpopulation, a set of identical septuplets must avoid being put to a long sleep by the government and dangerous infighting while investigating the disappearance of one of their own.",60.581223,/o6EsOqITcSzcdwD1zxBM9imdxjr.jpg,"[{'name': 'Vendome Pictures', 'id': 7460}, {'name': 'Nexus Factory', 'id': 7561}, {'name': 'Umedia', 'id': 19037}, {'name': 'Snd Films', 'id': 26591}, {'name': 'Raffaella Productions', 'id': 35916}, {'name': 'Title Media', 'id': 41813}]","[{'iso_3166_1': 'BE', 'name': 'Belgium'}, {'iso_3166_1': 'FR', 'name': 'France'}, {'iso_3166_1': 'GB', 'name': 'United Kingdom'}, {'iso_3166_1': 'US', 'name': 'United States of America'}]",2017-08-18,0.0,123.0,"[{'iso_639_1': 'en', 'name': 'English'}]",Released,Seven sisters. One identity.,What Happened to Monday,False,7.3,598.0,2017-08-18,8.0,2017.0,47.0
44628,False,,0,"[{'id': 16, 'name': 'Animation'}, {'id': 35, 'name': 'Comedy'}]",,413644,tt5715410,en,The Son of Bigfoot,"Teenage outsider Adam sets out on an epic and daring quest to uncover the mystery behind his long-lost dad, only to find out that he is none other than the legendary Bigfoot! He has been hiding deep in the forest for years to protect himself and his family from HairCo., a giant corporation eager to run scientific experiments with his special DNA. As father and son start making up for lost time after the boy's initial disbelief, Adam soon discovers that he too is gifted with superpowers beyond his imagination. But little do they know, HairCo. is on their tail as Adam's traces have led them to Bigfoot!",2.984512,/6stbYJynPLfXfe4kNLUNk9mcoD.jpg,[],"[{'iso_3166_1': 'BE', 'name': 'Belgium'}]",2017-07-27,0.0,92.0,"[{'iso_639_1': 'en', 'name': 'English'}]",Released,,The Son of Bigfoot,False,6.6,10.0,2017-07-27,7.0,2017.0,n/a
44629,False,,0,"[{'id': 28, 'name': 'Action'}, {'id': 18, 'name': 'Drama'}, {'id': 27, 'name': 'Horror'}, {'id': 53, 'name': 'Thriller'}]",http://tokyoghoul.jp/,433945,tt5815944,ja,東京喰種 トーキョーグール,"Ken Kaneki (Masataka Kubota) is a university student. He becomes injured by Rize, a human eating ghoul. Ken is saved from the ghoul when a steel frame falls on Rize. They are both sent to the hospital. Ken receives an organ transplant from Rize and becomes a half ghoul.",0.802191,/53Tjv28KGP7ZZh7XqTer90t6tMZ.jpg,"[{'name': 'Shochiku', 'id': 5906}]","[{'iso_3166_1': 'JP', 'name': 'Japan'}]",2017-07-29,0.0,119.0,"[{'iso_639_1': 'ja', 'name': '日本語'}]",Released,,Tokyo Ghoul,False,10.0,1.0,2017-07-29,7.0,2017.0,n/a
44631,False,,0,"[{'id': 18, 'name': 'Drama'}, {'id': 10749, 'name': 'Romance'}]",https://facebook.com/TestrolEsLelekrol/,436343,tt5607714,hu,Testről és lélekről,"Two introverted people find out by pure chance that they share the same dream every night. They are puzzled, incredulous, a bit frightened. As they hesitantly accept this strange coincidence, they try to recreate in broad daylight what happens in their dream.",1.737342,/uguWEoZelSSckxgiQctlkZ6gpfU.jpg,"[{'name': 'Inforg-M&M Film Kft.', 'id': 11008}]","[{'iso_3166_1': 'HU', 'name': 'Hungary'}]",2017-03-02,0.0,116.0,"[{'iso_639_1': 'hu', 'name': 'Magyar'}]",Released,,On Body and Soul,False,7.7,6.0,2017-03-02,3.0,2017.0,77.0
