,adult,belongs_to_collection,budget,genres,homepage,id,imdb_id,original_language,original_title,overview,popularity,poster_path,production_companies,production_countries,release_date,revenue,runtime,spoken_languages,status,tagline,title,video,vote_average,vote_count,Date,Month,Year,imdb_metascore
43296,False,"{'id': 133352, 'name': 'Resident Evil: Biohazard', 'poster_path': '/fICwXslWyYTEodNpnTlQUhOg7xl.jpg', 'backdrop_path': '/TSpFZFIgVX4I3Zsnlm3HAlDO14.jpg'}",0,"[{'id': 28, 'name': 'Action'}, {'id': 12, 'name': 'Adventure'}, {'id': 16, 'name': 'Animation'}, {'id': 27, 'name': 'Horror'}, {'id': 9648, 'name': 'Mystery'}, {'id': 878, 'name': 'Science Fiction'}]",http://www.residentevilvendetta.com/,400136,tt5776208,ja,バイオハザード ヴェンデッタ,BSAA Chris Redfield enlists the help of government agent Leon S. Kennedy and Professor Rebecca Chambers from Alexander Institute of Biotechnology to stop a death merchant with a vengeance from spreading a deadly virus in New York.,13.875911,/88qfHWhlOBYXp69277QFhdPYnWf.jpg,"[{'name': 'Capcom', 'id': 7220}, {'name': 'Stage 6 Films', 'id': 11341}, {'name': 'Kadokawa', 'id': 13845}, {'name': 'Capcom Company', 'id': 14788}, {'name': 'Marza animation planet', 'id': 77884}]","[{'iso_3166_1': 'JP', 'name': 'Japan'}]",2017-05-27,0.0,97.0,"[{'iso_639_1': 'en', 'name': 'English'}, {'iso_639_1': 'ja', 'name': '日本語'}]",Released,,Resident Evil: Vendetta,False,6.6,160.0,2017-05-27,5.0,2017.0,n/a
43298,False,,0,"[{'id': 35, 'name': 'Comedy'}]",,431071,tt6086080,en,Mad Families,Three families compete for a camping spot during a busy Fourth of July holiday weekend.,0.716404,/GqCyTtgZcAUdSY76qRvSVdbi1j.jpg,"[{'name': 'Crackle', 'id': 84021}]","[{'iso_3166_1': 'US', 'name': 'United States of America'}]",2017-01-12,0.0,0.0,"[{'iso_639_1': 'ru', 'name': 'Pусский'}, {'iso_639_1': 'en', 'name': 'English'}]",Released,Three familes. One campsite. May the worst family win.,Mad Families,False,3.5,10.0,2017-01-12,1.0,2017.0,n/a
43299,False,,0,"[{'id': 18, 'name': 'Drama'}, {'id': 35, 'name': 'Comedy'}]",,413648,tt5925968,fr,Les Fausses confidences,"Dorante, an impoverished young man, is taken on as a secretary by Araminte, a rich widow with whom he is secretly in love. The valet Dubois does all he can to get Araminte to fall in love with Dorante. Following his staging of Marivaux’s comedy at the Odéon theater, Luc Bondy turns the whole theater building into a film studio, placing his actors in the foyer, under the stage, in the kitchens, using the most unusual and unexpected spots to invent a new dynamic between theater and film.",0.219166,/kB8QdC8HG4zxoj8BLiuBsb6twhM.jpg,[],[],2017-04-13,0.0,85.0,"[{'iso_639_1': 'fr', 'name': 'Français'}]",Released,,False Confessions,False,0.0,1.0,2017-04-13,4.0,2017.0,41.0
43307,False,"{'id': 166373, 'name': 'The Marine Collection', 'poster_path': '/7sPY1VK4yD5Zlv16DUei65rtrjn.jpg', 'backdrop_path': '/rpUficLJq3I7GvRafTVT1TVRsms.jpg'}",0,"[{'id': 28, 'name': 'Action'}]",,445993,tt5781798,en,The Marine 5: Battleground,"While working as an EMT back stateside Jake Carter after responding to a distress call, finds himself caught up protecting a person of interest from a biker gang ruthlessly hunting them down.",9.930139,/9dbZqft6gS34f4qVncU6APBAKWU.jpg,"[{'name': 'WWE Studios', 'id': 10339}]","[{'iso_3166_1': 'US', 'name': 'United States of America'}]",2017-03-16,0.0,0.0,"[{'iso_639_1': 'en', 'name': 'English'}]",Released,One Marine. Two Gangs. One Long Night,The Marine 5: Battleground,False,5.9,26.0,2017-03-16,3.0,2017.0,n/a
43308,False,,0,"[{'id': 27, 'name': 'Horror'}]",,432364,tt5607782,en,The Covenant,"After the tragic deaths of her husband and daughter, Sarah Doyle moves back to her childhood home with her estranged brother, Richard. It's not long before Sarah begins to experience supernatural phenomena of a violent and hostile nature.",1.257845,/sc4Fs5yZUkHfjSlYfZBpIv5vRCw.jpg,"[{'name': 'FunHouse Features', 'id': 17157}]","[{'iso_3166_1': 'US', 'name': 'United States of America'}]",2017-02-07,0.0,90.0,"[{'iso_639_1': 'en', 'name': 'English'}]",Released,Evil has descended,The Covenant,False,5.0,6.0,2017-02-07,2.0,2017.0,n/a
43317,False,,0,"[{'id': 10751, 'name': 'Family'}, {'id': 14, 'name': 'Fantasy'}, {'id': 35, 'name': 'Comedy'}]",http://www.nick.com/rufus-movie/,435737,tt5687968,en,Rufus 2,Rufus is a dog but turns into a human with a pendant. He meets a girl named Kat who asks him to go out. Kat is a cat who can also turn into a human as well.,2.069952,/n5RikV29yCTd3GYWnT3h7MWOa9k.jpg,"[{'name': 'Nickelodeon Productions', 'id': 16443}]","[{'iso_3166_1': 'US', 'name': 'United States of America'}]",2017-01-16,0.0,46.0,"[{'iso_639_1': 'en', 'name': 'English'}]",Released,Paws meets Claws,Rufus 2,False,0.0,0.0,2017-01-16,1.0,2017.0,n/a
43318,False,,10000000,"[{'id': 53, 'name': 'Thriller'}, {'id': 18, 'name': 'Drama'}, {'id': 80, 'name': 'Crime'}]",http://www.focusfeatures.com/thebookofhenry,382614,tt4572792,en,The Book of Henry,"Naomi Watts stars as Susan, a single mother of two, working as a waitress in a small town. Her son, Henry, is an 11-year-old genius who not only manages the family finances but acts as emotional support for his mother and younger brother. When Henry discovers that the girl next door has a terrible secret, he implores Susan to take matters into her own hands in this imaginative and emotional drama.",24.553725,/suLFg4UjvM5BoDipg2Wu3gZ802T.jpg,"[{'name': 'Sidney Kimmel Entertainment', 'id': 737}, {'name': 'Double Nickel Entertainment', 'id': 10138}]","[{'iso_3166_1': 'US', 'name': 'United States of America'}]",2017-06-16,4219536.0,105.0,"[{'iso_639_1': 'en', 'name': 'English'}]",Released,Never leave things undone.,The Book of Henry,False,7.6,84.0,2017-06-16,6.0,2017.0,31.0
43325,False,,0,"[{'id': 18, 'name': 'Drama'}]",,425751,tt5655222,en,The Hero,"Lee, a former Western film icon, is living a comfortable existence lending his golden voice to advertisements and smoking weed. After receiving a lifetime achievement award and unexpected news, Lee reexamines his past, while a chance meeting with a sardonic comic has him looking to the future.",6.549788,/1xz4ggwOJi8FUsjsLDbFrCxyK0e.jpg,"[{'name': 'Northern Lights Films', 'id': 8714}, {'name': 'Park Pictures', 'id': 13466}, {'name': 'Houston King Productions', 'id': 66044}]","[{'iso_3166_1': 'US', 'name': 'United States of America'}]",2017-06-09,3384747.0,97.0,"[{'iso_639_1': 'en', 'name': 'English'}]",Released,,The Hero,False,6.7,17.0,2017-06-09,6.0,2017.0,61.0
43328,False,,0,"[{'id': 99, 'name': 'Documentary'}]",http://www.altimeterfilms.com/citizen-jane-battle-for-the-city/,411013,tt3699354,en,Citizen Jane: Battle for the City,Writer and urban activist Jane Jacobs fights to save historic New York City during the ruthless redevelopment era of urban planner Robert Moses in the 1960s.,0.192367,/5oX9F1kLbqH08Gt5y8plRG0KFRe.jpg,"[{'name': 'Altimeter Films', 'id': 82064}]","[{'iso_3166_1': 'US', 'name': 'United States of America'}]",2017-04-21,0.0,92.0,"[{'iso_639_1': 'en', 'name': 'English'}]",Released,,Citizen Jane: Battle for the City,False,7.0,2.0,2017-04-21,4.0,2017.0,70.0
43335,False,,0,"[{'id': 18, 'name': 'Drama'}, {'id': 53, 'name': 'Thriller'}, {'id': 10752, 'name': 'War'}]",http://thewallthemovie.com/,405775,tt4218696,en,The Wall,An American sniper and his spotter engage in a deadly cat-and-mouse game with an Iraqi sniper.,15.5975,/8POAZwZpp24l1IgKKM8ZRAQ2kid.jpg,"[{'name': 'Big Indie Pictures', 'id': 6831}, {'name': 'Amazon Studios', 'id': 20580}, {'name': 'picrow', 'id': 79111}]","[{'iso_3166_1': 'US', 'name': 'United States of America'}]",2017-05-12,1803009.0,89.0,"[{'iso_639_1': 'en', 'name': 'English'}]",Released,This isn't war. It's a game.,The Wall,False,6.1,117.0,2017-05-12,5.0,2017.0,57.0
43339,False,,7000000,"[{'id': 28, 'name': 'Action'}]",http://wholeworldatourfeet.com/en/,440508,tt6282314,en,Diamond Cartel,,1.95914,/zkiz6Tx5wiSo2huOnKWRQrsbnoX.jpg,"[{'name': 'Cleopatra', 'id': 73934}]","[{'iso_3166_1': 'KZ', 'name': 'Kazakhstan'}]",2017-03-24,0.0,100.0,"[{'iso_639_1': 'ru', 'name': 'Pусский'}, {'iso_639_1': 'en', 'name': 'English'}]",Released,,Diamond Cartel,False,7.2,5.0,2017-03-24,3.0,2017.0,n/a
43346,False,,0,"[{'id': 18, 'name': 'Drama'}, {'id': 35, 'name': 'Comedy'}]",,408374,tt5820148,el,Άφτερλωβ,"One year after their break-up, Nikos locks Sofia up in the basement of a studio, determined not to let her out until he understands exactly why they broke up.",0.138258,/byWwlWLifmEfohzPtcPK6ZtjoxP.jpg,"[{'name': 'Hellenic Radio & Television (ERT)', 'id': 7255}, {'name': 'Faliro House Productions S.A.', 'id': 56630}, {'name': 'Marni Films', 'id': 63059}, {'name': '235 Films', 'id': 68579}]","[{'iso_3166_1': 'GR', 'name': 'Greece'}]",2017-05-18,0.0,94.0,"[{'iso_639_1': 'el', 'name': 'ελληνικά'}]",Released,,Afterlov,False,0.0,0.0,2017-05-18,5.0,2017.0,n/a
43353,False,,2800000,"[{'id': 27, 'name': 'Horror'}, {'id': 9648, 'name': 'Mystery'}, {'id': 878, 'name': 'Science Fiction'}]",http://phoenixforgotten.com/,443319,tt6574272,en,Phoenix Forgotten,"20 years after three teenagers disappeared in the wake of mysterious lights appearing above Phoenix, Arizona, unseen footage from that night has been discovered, chronicling the final hours of their fateful expedition.",12.560942,/8GJ9a0FgkCKIqKvGtkppTTALGG3.jpg,"[{'name': 'Scott Free Productions', 'id': 1645}, {'name': 'Cinelou Films', 'id': 39644}]","[{'iso_3166_1': 'US', 'name': 'United States of America'}]",2017-04-21,3600000.0,80.0,"[{'iso_639_1': 'en', 'name': 'English'}]",Released,Based on Shocking Untold True Events,Phoenix Forgotten,False,5.7,52.0,2017-04-21,4.0,2017.0,33.0
43354,False,,0,"[{'id': 18, 'name': 'Drama'}, {'id': 35, 'name': 'Comedy'}]",,435707,tt5808778,es,Pieles,A story about four spanish people who see themselfs as freaks and seldom go outside...,3.293257,/aUbTVTJpRLINDx56OoIJfvNAmg5.jpg,"[{'name': 'NetFlix', 'id': 8858}, {'name': 'Nadie es Perfecto', 'id': 10012}, {'name': 'Pokeepsie Films', 'id': 32485}, {'name': 'The Other Side Films', 'id': 78113}]","[{'iso_3166_1': 'ES', 'name': 'Spain'}]",2017-04-15,0.0,78.0,"[{'iso_639_1': 'es', 'name': 'Español'}]",Released,,Skins,False,7.1,67.0,2017-04-15,4.0,2017.0,n/a
43355,False,,0,"[{'id': 18, 'name': 'Drama'}]",http://www.hbo.com/movies/the-immortal-life-of-henrietta-lacks,424600,tt5686132,en,The Immortal Life of Henrietta Lacks,An African-American woman becomes an unwitting pioneer for medical breakthroughs when her cells are used to create the first immortal human cell line in the early 1950s.,3.017803,/sJDC4YM3vfSOBQDiKbjQIAxrvkn.jpg,"[{'name': 'Harpo Films', 'id': 3298}, {'name': 'HBO Films', 'id': 7429}, {'name': 'Cine Mosaic', 'id': 21864}]","[{'iso_3166_1': 'US', 'name': 'United States of America'}]",2017-04-22,0.0,93.0,"[{'iso_639_1': 'en', 'name': 'English'}]",Released,Discover what you are made of,The Immortal Life of Henrietta Lacks,False,6.5,13.0,2017-04-22,4.0,2017.0,n/a
43357,False,,0,"[{'id': 99, 'name': 'Documentary'}]",,442640,tt6399400,fi,Kiehumispiste,Boiling Point (original title Kiehumispiste) describes the different reactions the Finnish people had to the large immigration amounts in 2015-2016.,0.112133,/is6UufqYRCnL61xzBSd6l5JL6Wn.jpg,"[{'name': 'Mouka Filmi Oy', 'id': 10195}]","[{'iso_3166_1': 'FI', 'name': 'Finland'}]",2017-01-23,0.0,90.0,"[{'iso_639_1': 'fi', 'name': 'suomi'}]",Released,,Boiling Point,False,8.0,1.0,2017-01-23,1.0,2017.0,n/a
43360,False,,0,"[{'id': 18, 'name': 'Drama'}, {'id': 10749, 'name': 'Romance'}]",,399217,tt3467914,en,Tommy's Honour,"In every generation, a torch passes from father to son. And that timeless dynamic is the beating heart of Tommy's Honor - an intimate, powerfully moving tale of the real-life founders of the modern game of golf.",1.774843,/sKrZ7bgHPXUt5XrDN5bD2fQNZY1.jpg,[],[],2017-07-07,0.0,117.0,"[{'iso_639_1': 'en', 'name': 'English'}]",Released,The pride of a father. The love of a wife. The soul of a rebel. The heart of a champion.,Tommy's Honour,False,6.9,5.0,2017-07-07,7.0,2017.0,56.0
43365,False,,1050000,"[{'id': 18, 'name': 'Drama'}]",,412202,tt5016946,en,Handsome Devil,A music-mad 16-year-old outcast at a rugby-mad boarding school forms an unlikely friendship with his dashing new roommate.,16.112052,/xlHOWQFgcGV4KcZKLzYBZ21gjGT.jpg,"[{'name': 'Treasure Entertainment', 'id': 21872}]","[{'iso_3166_1': 'IE', 'name': 'Ireland'}]",2017-02-15,0.0,95.0,"[{'iso_639_1': 'en', 'name': 'English'}]",Released,,Handsome Devil,False,7.3,81.0,2017-02-15,2.0,2017.0,60.0
43371,False,,916000,"[{'id': 18, 'name': 'Drama'}]",,333384,tt1366338,en,Lowriders,"A young street artist in East Los Angeles is caught between his father's obsession with lowrider car culture, his ex-felon brother and his need for self-expression.",4.612622,/mafycJVTwbsArAycD9yv1KzeAxH.jpg,"[{'name': 'Imagine Entertainment', 'id': 23}, {'name': 'Universal Pictures', 'id': 33}, {'name': 'Blumhouse Productions', 'id': 3172}]","[{'iso_3166_1': 'US', 'name': 'United States of America'}]",2017-04-28,2403885.0,99.0,"[{'iso_639_1': 'en', 'name': 'English'}]",Released,,Lowriders,False,7.0,20.0,2017-04-28,4.0,2017.0,57.0
43374,False,,0,"[{'id': 53, 'name': 'Thriller'}]",,410212,tt5584732,de,Die Hölle – Inferno,A young Turkish woman living in Vienna feels increasingly lonely after she witnesses a murder and finds herself next on the killer's agenda in this smart and gritty thriller from the director of ANATOMY and the Oscar-winning THE COUNTERFEITERS.,1.241803,/oGPXfMyzfy3oRN8m2MbRHMZMcwz.jpg,"[{'name': 'Allegro-Film', 'id': 404}, {'name': 'X-Filme Creative Pool', 'id': 1972}, {'name': 'The Amazing Film Company', 'id': 80107}]","[{'iso_3166_1': 'DE', 'name': 'Germany'}, {'iso_3166_1': 'AT', 'name': 'Austria'}]",2017-01-19,0.0,92.0,"[{'iso_639_1': 'en', 'name': 'English'}, {'iso_639_1': 'de', 'name': 'Deutsch'}, {'iso_639_1': 'tr', 'name': 'Türkçe'}]",Released,Wir kommen nicht in die Hölle - Die Hölle kommt zu uns,Cold Hell,False,6.0,4.0,2017-01-19,1.0,2017.0,n/a
43388,False,,65000,"[{'id': 27, 'name': 'Horror'}, {'id': 878, 'name': 'Science Fiction'}, {'id': 53, 'name': 'Thriller'}]",http://thedarktapes.com/,390883,tt5068650,en,The Dark Tapes,"A genre-defying mixture of horror, sci-fi, myth, mystery and thrills told as four interlocking tales in one intelligent anthology. Ghosts, spirits, creatures, demons and more from the paranormal world collide with rational curiosity.",3.525879,/9TDeTn1TQhkPcH9BoEQ6NWXc38j.jpg,"[{'name': 'Thunder Road Incorporated', 'id': 74958}]","[{'iso_3166_1': 'US', 'name': 'United States of America'}]",2017-04-17,0.0,98.0,"[{'iso_639_1': 'en', 'name': 'English'}]",Released,Face the unknown,The Dark Tapes,False,5.0,20.0,2017-04-17,4.0,2017.0,n/a
43393,False,,0,"[{'id': 28, 'name': 'Action'}, {'id': 878, 'name': 'Science Fiction'}]",,271404,tt1724970,en,Beyond Skyline,A tough-as-nails detective embarks on a relentless pursuit to free his son from a nightmarish alien warship.,6.416249,/ktZvjFmwCLrMXtr1dl6o5PhhHS4.jpg,"[{'name': 'Hydraulx', 'id': 10936}, {'name': 'Infinite Frameworks Pte. Ltd.', 'id': 17364}, {'name': 'Mirabelle Pictures', 'id': 39708}, {'name': 'North Hollywood Films', 'id': 78752}, {'name': 'Beyond The Mothership', 'id': 87026}]","[{'iso_3166_1': 'SG', 'name': 'Singapore'}]",2017-10-20,0.0,0.0,"[{'iso_639_1': 'en', 'name': 'English'}]",Post Production,,Beyond Skyline,False,0.0,30.0,2017-10-20,10.0,2017.0,46.0
43394,False,,0,"[{'id': 35, 'name': 'Comedy'}]",,321757,tt4283414,en,Punching Henry,"Comedian Henry Phillips is lured to LA by a renowned TV producer who wants to bring his story of failure to the screen. But when a major network gets involved, Henry must decide whether he wants to make jokes for a living, or be the butt of them.",1.797552,/989X25XGv7r0YWB0nY3OvgNqJbx.jpg,"[{'name': 'Permut Presentations', 'id': 455}, {'name': 'Whitewater Films', 'id': 3095}, {'name': 'Tilted Windmill Productions', 'id': 45086}]","[{'iso_3166_1': 'US', 'name': 'United States of America'}]",2017-02-24,0.0,98.0,"[{'iso_639_1': 'en', 'name': 'English'}]",Released,Comedy isn't funny.,Punching Henry,False,6.2,13.0,2017-02-24,2.0,2017.0,65.0
43403,False,,0,"[{'id': 35, 'name': 'Comedy'}]",,425134,tt4795124,en,How to Be a Latin Lover,An aging Latin lover gets dumped by his sugar mama and must fend for himself in a harsh world.,7.299803,/cn6m1JrtLolcHRRgHrl8thEzcZb.jpg,"[{'name': 'Pantelion Films', 'id': 58399}]","[{'iso_3166_1': 'US', 'name': 'United States of America'}]",2017-04-28,26251899.0,115.0,"[{'iso_639_1': 'es', 'name': 'Español'}, {'iso_639_1': 'en', 'name': 'English'}]",Released,Fifty shades grayer,How to Be a Latin Lover,False,6.1,85.0,2017-04-28,4.0,2017.0,54.0
43405,False,"{'id': 309300, 'name': 'The Trip Collection', 'poster_path': '/6ATyIyUbtgI0napk5lFxh6lQTgF.jpg', 'backdrop_path': None}",0,"[{'id': 18, 'name': 'Drama'}, {'id': 35, 'name': 'Comedy'}]",,426264,tt6193424,en,The Trip to Spain,Steve Coogan and Rob Brydon embark on a road trip along the coast of Spain.,1.223145,/74RSdBGWdtbdClQ2NGJeTTyO7fq.jpg,"[{'name': 'Revolution Films', 'id': 163}]","[{'iso_3166_1': 'GB', 'name': 'United Kingdom'}]",2017-08-31,0.0,115.0,"[{'iso_639_1': 'en', 'name': 'English'}, {'iso_639_1': 'es', 'name': 'Español'}]",Released,,The Trip to Spain,False,7.0,6.0,2017-08-31,8.0,2017.0,66.0
43414,False,,0,"[{'id': 99, 'name': 'Documentary'}]",https://www.netflix.com/title/80168227,430830,tt6333064,en,Nobody Speak: Trials of the Free Press,The courtroom and publicity battles between the superstar wrestler and the notorious website explode in a sensational trial all about the limits of the First Amendment and the new no holds barred nature of celebrity life in an internet dominated society.,0.765677,/kX54qobSPGNjYa4UZRit5DrM5TI.jpg,[],[],2017-01-24,0.0,105.0,"[{'iso_639_1': 'en', 'name': 'English'}]",Released,The power of money to silence a free press.,Nobody Speak: Trials of the Free Press,False,5.5,11.0,2017-01-24,1.0,2017.0,68.0
43415,False,,0,"[{'id': 35, 'name': 'Comedy'}, {'id': 18, 'name': 'Drama'}]",,403431,tt5805752,en,Brigsby Bear,"Brigsby Bear Adventures is a children's TV show produced for an audience of one: James. When the show abruptly ends, James's life changes forever, and he sets out to finish the story himself.",2.216551,/ig0W1cGLFyTGQCDMb9xemlOGOBy.jpg,"[{'name': 'Sony Pictures Classics', 'id': 58}, {'name': '3311 Productions', 'id': 19632}, {'name': 'Lord Miller', 'id': 77973}, {'name': 'Kablamo!', 'id': 78472}]","[{'iso_3166_1': 'US', 'name': 'United States of America'}]",2017-07-27,0.0,100.0,"[{'iso_639_1': 'en', 'name': 'English'}]",Released,,Brigsby Bear,False,7.0,12.0,2017-07-27,7.0,2017.0,68.0
43418,False,,0,"[{'id': 35, 'name': 'Comedy'}]",https://www.netflix.com/title/80117484,451709,tt6218048,en,Lucas Brothers: On Drugs,"Deadpan twin comics Keith and Kenny Lucas take the stage in Brooklyn with a set that touches on drugs, race, Deion Sanders, teachers and O.J. Simpson.",0.552579,/vTxUOKuXJVOYo3Y5erJZU7h2GUm.jpg,"[{'name': 'NetFlix', 'id': 8858}]","[{'iso_3166_1': 'US', 'name': 'United States of America'}]",2017-04-18,0.0,49.0,"[{'iso_639_1': 'en', 'name': 'English'}]",Released,,Lucas Brothers: On Drugs,False,6.3,4.0,2017-04-18,4.0,2017.0,n/a
43420,False,,0,"[{'id': 99, 'name': 'Documentary'}]",https://www.iamheathledger.com,450945,tt6739646,en,I Am Heath Ledger,"The life and career of an actor, artist, and icon. His own journey through his own camera.",2.293791,/nzJ44bpFglwElWk1l24bTNXE9BX.jpg,[],[],2017-04-23,0.0,90.0,"[{'iso_639_1': 'en', 'name': 'English'}]",Released,,I Am Heath Ledger,False,7.5,26.0,2017-04-23,4.0,2017.0,68.0
43440,False,,0,"[{'id': 18, 'name': 'Drama'}, {'id': 10752, 'name': 'War'}]",,390054,tt2582576,en,Sand Castle,"Set during the occupation of Iraq, a squad of U.S. soldiers try to protect a small village.",7.823933,/c9buG2jVRgAu68E4D4jpwlgqhO1.jpg,"[{'name': 'The Mark Gordon Company', 'id': 1557}, {'name': 'International Traders', 'id': 6408}, {'name': 'Treehouse Pictures', 'id': 14580}]","[{'iso_3166_1': 'GB', 'name': 'United Kingdom'}]",2017-04-21,0.0,113.0,"[{'iso_639_1': 'en', 'name': 'English'}]",Released,Home is a war away,Sand Castle,False,6.3,137.0,2017-04-21,4.0,2017.0,45.0
43450,False,,0,"[{'id': 28, 'name': 'Action'}, {'id': 878, 'name': 'Science Fiction'}, {'id': 12, 'name': 'Adventure'}]",,443297,tt3705822,en,Moontrap: Target Earth,A long forgotten ancient spacecraft discovered on Earth. Investigations carried out by Scout transport her to the moon whereupon she meets the impressive machines preserving the wisdom of that long lost civilization.,0.427982,/piTPKYtaZjwnCRlu19zwzqaDLuN.jpg,"[{'name': 'MT2 Productions', 'id': 86979}]","[{'iso_3166_1': 'US', 'name': 'United States of America'}]",2017-02-07,0.0,81.0,"[{'iso_639_1': 'en', 'name': 'English'}]",Released,,Moontrap: Target Earth,False,4.0,8.0,2017-02-07,2.0,2017.0,n/a
43452,False,,0,"[{'id': 99, 'name': 'Documentary'}]",http://www.uncertainfilm.com,333295,tt2630352,en,Uncertain,"A keen observation of a sun-dappled and still-watered swamp, Uncertain contemplates a frequently overlooked and enigmatic town whose lake, and only real source of income, comes under threat from an aquatic nuisance of the botanical variety. Perhaps unsurprisingly for a site so-named, there is a lack of consensus about the Texas town's origin: whether the result of a surveyor's confusion when marking an early map, or steamboat captains' belief that docking there was an unknowable, impossible task, an auspicious beginning is offered for the unsettled and yearning inhabitants.",0.415139,/6LpJlqR9vBpc50zRKDo3Hzl7L9J.jpg,"[{'name': 'Lucid', 'id': 87714}]","[{'iso_3166_1': 'US', 'name': 'United States of America'}]",2017-03-09,0.0,82.0,"[{'iso_639_1': 'en', 'name': 'English'}]",Released,,Uncertain,False,5.0,1.0,2017-03-09,3.0,2017.0,89.0
43499,False,,707503,"[{'id': 35, 'name': 'Comedy'}]",,430263,tt5161058,ru,"Гуляй, Вася!","Contemporary Russia. Mitya and Alisa are set to get married. The problem is that Mitya is still married to Vasya, who refuses to grant him a divorce. Can Mitya and his friends convince Vasya to change her mind?",1.681316,/gIipyI9TYvet7q9z5KPwf6cRPqL.jpg,"[{'name': 'Yellow, Black & White', 'id': 42877}]","[{'iso_3166_1': 'RU', 'name': 'Russia'}]",2017-02-16,4781454.0,90.0,"[{'iso_639_1': 'ru', 'name': 'Pусский'}]",Released,,"Have Fun, Vasya!",False,7.2,13.0,2017-02-16,2.0,2017.0,n/a
43504,False,,0,"[{'id': 28, 'name': 'Action'}]",,435366,tt6399158,ko,조작된 도시,"In real life, Kwon Yoo is unemployed, but in the virtual game world he is the best leader. Kwon Yoo is then framed for a murder. With the help of hacker Yeo-Wool, he tries to uncover the truth behind the murder case.",2.358168,/8tE4MhhuWHize6pNyxAtakUyNZc.jpg,"[{'name': 'TPS Company', 'id': 92805}]","[{'iso_3166_1': 'KR', 'name': 'South Korea'}]",2017-02-09,0.0,126.0,"[{'iso_639_1': 'ko', 'name': '한국어/조선말'}]",Released,,Fabricated City,False,7.8,24.0,2017-02-09,2.0,2017.0,n/a
43521,False,,0,"[{'id': 28, 'name': 'Action'}, {'id': 53, 'name': 'Thriller'}]",,291276,tt1734493,en,Unlocked,"After failing to apprehend the terrorist behind a Paris attack that claimed dozens of lives, CIA agent Alice Racine is forced to live in London as a caseworker. Her mentor unexpectedly calls her back into action when the CIA discovers that another attack is imminent. Alice soon learns that the classified information she's uncovered has been compromised. Running for her life, she turns to a former soldier to help her prevent a lethal biological attack on the citizens of London.",13.371144,/fBDLdEraxCBKGmOPb6pJPYiDQh1.jpg,"[{'name': 'Di Bonaventura Pictures', 'id': 435}, {'name': 'Lipsync Productions', 'id': 9987}, {'name': 'Silver Reel', 'id': 12075}, {'name': 'Czech Anglo Productions', 'id': 20473}, {'name': 'Bloom', 'id': 32554}, {'name': 'SRA Productions', 'id': 94135}]","[{'iso_3166_1': 'CZ', 'name': 'Czech Republic'}, {'iso_3166_1': 'CH', 'name': 'Switzerland'}, {'iso_3166_1': 'GB', 'name': 'United Kingdom'}, {'iso_3166_1': 'US', 'name': 'United States of America'}]",2017-04-27,0.0,98.0,"[{'iso_639_1': 'ar', 'name': 'العربية'}, {'iso_639_1': 'en', 'name': 'English'}]",Released,,Unlocked,False,6.2,131.0,2017-04-27,4.0,2017.0,46.0
43524,False,,0,"[{'id': 18, 'name': 'Drama'}, {'id': 9648, 'name': 'Mystery'}, {'id': 10749, 'name': 'Romance'}, {'id': 53, 'name': 'Thriller'}]",http://voicefromthestone.com/,301372,tt1544608,en,Voice from the Stone,"Set in 1950s Tuscany, Voice from the Stone is the haunting and suspenseful story of Verena, a solemn nurse drawn to aid a young boy who has fallen silent since the sudden passing of his mother.",5.91121,/6pJseCfsd90nA26Jz1HTSuyRzGz.jpg,"[{'name': 'Zanuck Independent', 'id': 6716}, {'name': 'Producer Capital Fund', 'id': 83497}, {'name': 'Code 39 Films', 'id': 83498}]","[{'iso_3166_1': 'IT', 'name': 'Italy'}, {'iso_3166_1': 'US', 'name': 'United States of America'}]",2017-04-28,0.0,94.0,"[{'iso_639_1': 'en', 'name': 'English'}, {'iso_639_1': 'it', 'name': 'Italiano'}]",Released,Silence is calling,Voice from the Stone,False,5.2,88.0,2017-04-28,4.0,2017.0,42.0
43526,False,,0,"[{'id': 18, 'name': 'Drama'}, {'id': 35, 'name': 'Comedy'}, {'id': 53, 'name': 'Thriller'}, {'id': 80, 'name': 'Crime'}]",https://www.netflix.com/title/80164212,411405,tt5717492,en,Small Crimes,"A disgraced former cop, fresh off a six-year prison sentence for attempted murder - returns home looking for redemption but winds up trapped in the mess he left behind.",7.219022,/z7jmLmrs0pLlDU4GI6ItaJeqlET.jpg,"[{'name': 'Rooks Nest Entertainment', 'id': 34456}]","[{'iso_3166_1': 'CA', 'name': 'Canada'}, {'iso_3166_1': 'US', 'name': 'United States of America'}]",2017-04-28,0.0,95.0,"[{'iso_639_1': 'en', 'name': 'English'}, {'iso_639_1': 'es', 'name': 'Español'}]",Released,,Small Crimes,False,5.8,55.0,2017-04-28,4.0,2017.0,60.0
